{
  "metadata": {
    "id": "examples/read-only-inspection",
    "version": "1.0.0",
    "source": "local",
    "checksum": "sha256:0c69f7a696aababca9b9da6b88bcdff88a9d82d08a81d0d53d295e73dca375dc",
    "requires_engine": ">=0.5.0"
  },
  "contract": {
    "inputs": [],
    "preconditions": [],
    "outputs": [],
    "required_scopes": [
      "notify:send"
    ],
    "timeout_seconds": 30,
    "idempotency_check": {
      "command": "true",
      "expect_exit_code": 0
    },
    "error_codes": []
  },
  "observability": {
    "emit_events": true,
    "audit_artifacts": [],
    "failure_modes": [],
    "declared_side_effects": []
  },
  "steps": [
    {
      "name": "emit_read_only_notice",
      "action": "notify",
      "args": [
        "message",
        "read-only inspection example completed"
      ]
    }
  ]
}
